{"number": 12, "name": "Eric Johnson", "age": 30, "nationality": "USA", "shirt_number": 12, "position": "Goalkeeper", "preferred_foot": "Left", "role": "Bench", "team": "Everglade FC", "height_cm": 185, "weight_kg": 80, "overall_rating": 76, "is_injured": false, "form": 7, "goals": 0, "assists": 0, "yellow_cards": 2, "red_cards": 0, "bio": "Hailing from the bustling streets of Miami, Eric Johnson is known for his quick reflexes and fearless approach to goalkeeping. His left foot is not just for kicking but also for orchestrating play from the back, commanding the defense with a calm yet fiery presence. Always ready to dive into action, he's a beloved figure among fans for his dedication and the vibrant spirit he brings to the pitch.", "profile_pic": "A portrait of Eric Johnson, a 30-year-old American goalkeeper for Everglade FC. Standing confidently at 185 cm tall and weighing 80 kg, he has an athletic build, showcasing his readiness for action. His facial features reflect his Miami roots: a sun-kissed complexion, short dark hair styled neatly, and intense green eyes that convey focus and determination.\n\nHe wears the Everglade FC home kit, which consists of a vibrant teal jersey with white trim, featuring his number 12 prominently displayed on the back. The kit is completed with matching shorts and socks, and he sports a pair of black goalkeeper gloves, ready for any challenge that comes his way.\n\nThe setting is a press photo backdrop, with the stadium in soft focus behind him, highlighting his team colors. He stands in a strong pose, feet shoulder-width apart, with his left foot slightly forward as if about to take a step. His expression is a blend of fierce concentration and approachable charm, embodying a passionate dedication to the sport. The mood is energetic yet composed, reflecting his solid form of 7 and an overall rating of 76, with no indications of injury or defeat. The image captures an essence of resilience, making him a beloved figure among the fans."}