{"number": 8, "name": "Nicholas Jackson", "age": 32, "nationality": "USA", "shirt_number": 8, "position": "Central Mid", "preferred_foot": "Right", "role": "Starter", "team": "Everglade FC", "height_cm": 178, "weight_kg": 76, "overall_rating": 85, "is_injured": false, "form": 7, "goals": 12, "assists": 15, "yellow_cards": 3, "red_cards": 1, "bio": "Nicholas Jackson, a dynamic Central Midfielder, is known for his razor-sharp passing and tenacious tackling. At 32 years old, he blends experience with youthful exuberance, mesmerizing fans with his flashy footwork and unyielding spirit on the field. Hailing from the vibrant landscapes of the USA, his infectious enthusiasm and flair embody the wild essence of Everglade FC, captivating the South Florida crowd with every touch.", "profile_pic": "A realistic portrait of Nicholas Jackson, a 32-year-old American professional soccer player. He stands confidently at 178 cm and weighs 76 kg, showcasing a strong yet athletic build. His right foot is slightly forward, emphasizing his central midfielder position. He has a warm smile, revealing a mix of determination and approachability in his bright blue eyes. His features are defined, with short, neatly styled black hair and a slight stubble that adds to his charming, youthful vibe.\n\nNicholas wears the Everglade FC home kit, which consists of a vibrant green jersey with the team logo emblazoned on the left chest, paired with matching shorts. The shirt is slightly fitted, accentuating his athletic frame, and he sports the number 8 prominently displayed on both his jersey and shorts.\n\nThe background is a blurred view of a packed stadium under the bright South Florida sun, capturing the energy of the fans. Nicholas stands in a dynamic pose, slightly tilted to one side, with one foot resting on a soccer ball. His arms are crossed, signaling confidence and readiness. His overall mood radiates positivity, enhanced by his strong form rating of 7 and recent performance stats, showcasing both his goals and assists. The atmosphere communicates excitement and anticipation, reflecting his status as a starter without any indication of injury."}