{"number": 4, "name": "Zachary Garcia", "age": 29, "nationality": "USA", "shirt_number": 4, "position": "Center Back", "preferred_foot": "Right", "role": "Starter", "team": "Everglade FC", "height_cm": 182, "weight_kg": 78, "overall_rating": 85, "is_injured": false, "form": 8, "goals": 3, "assists": 1, "yellow_cards": 5, "red_cards": 0, "bio": "Zachary Garcia, a formidable Center Back, commands the pitch with a blend of tenacity and tactical acumen. Hailing from the bustling streets of Miami, he embodies the vibrant spirit of Everglade FC, often throwing himself into the fray to thwart attackers. With his trademark sliding tackles and keen sense of positioning, he remains a cornerstone of the defense, inspiring teammates with his unwavering hustle and determination.", "profile_pic": "A detailed portrait of Zachary Garcia, a 29-year-old male soccer player from the USA. He stands confidently at 182 cm tall and weighs 78 kg, with a strong, athletic build indicative of a seasoned center back. His facial features reflect determination and charisma, with chiseled jawlines, short dark hair, and a focused gaze that captures his vibrant spirit. \n\nZachary is wearing the Everglade FC team kit, which consists of a deep green jersey with white accents, displaying his number 4 prominently on the back. His shorts match the jersey, and he sports black and white cleats suitable for a solid grip on the pitch. The kit fits snugly, emphasizing his muscular frame, while also capturing the essence of his energetic and dynamic playing style.\n\nIn the background, a soccer field is faintly visible, with goalposts and dynamic stadium lights adding to the matchday ambiance. Zachary assumes a poised stance, slightly bending his knees and leaning forward, ready to spring into action, embodying the form of a player in prime condition. His expression is one of focus and resolve, perfectly reflecting his status as a starter, symbolizing his tenacity on the field without any visible signs of injury. Overall, the scene conveys a sense of confidence, strength, and readiness, inviting viewers to appreciate the essence of a dedicated professional athlete."}