{"number": 1, "name": "Eric Miller", "age": 28, "nationality": "USA", "shirt_number": 1, "position": "Goalkeeper", "preferred_foot": "Right", "role": "Starter", "team": "Everglade FC", "height_cm": 185, "weight_kg": 80, "overall_rating": 88, "is_injured": false, "form": 8, "goals": 0, "assists": 0, "yellow_cards": 2, "red_cards": 0, "bio": "Eric Miller, a dynamic goalkeeper with a commanding presence, thrives under pressure, effortlessly diving to make game-changing saves. A proud product of Miami, he embodies the fiery spirit of Everglade FC, showcasing agility and flair that resonates with the team's wild, unpredictable style. His leadership on the field inspires teammates to elevate their game, making him an irreplaceable asset.", "profile_pic": "A realistic portrait of a 28-year-old male soccer player, Eric Miller, standing confidently in a matchday portrait. He is 185 cm tall with a strong, athletic build weighing 80 kg. His light brown hair is neatly styled, and he has a determined expression that exudes charisma and confidence. His skin tone is light, emphasizing his American nationality. He wears the vibrant team kit of Everglade FC\u2014bright green and blue with bold patterns, featuring the team\u2019s logo prominently on the chest. His shirt proudly displays the number 1. \n\nThe pose captures him in a slightly angled stance, hands on hips, which showcases his commanding presence as a goalkeeper. The background features a blurred stadium setting with fans in the stands, adding a lively atmosphere. The mood is energetic and focused, reflecting his high form rating of 8. His gaze is intense yet inspiring, radiating a sense of leadership and passion for the game. The image encapsulates his role as a starter and dynamic playmaker, underscoring his agility and flair without any signs of injury."}