{"number": 22, "name": "Ryan Martinez", "age": 25, "nationality": "USA", "shirt_number": 22, "position": "Various", "preferred_foot": "Right", "role": "Reserve/Prospect", "team": "Everglade FC", "height_cm": 182, "weight_kg": 75, "overall_rating": 78, "is_injured": false, "form": 7, "goals": 10, "assists": 8, "yellow_cards": 3, "red_cards": 1, "bio": "With his nimble footwork and explosive pace, Ryan Martinez dances down the flanks like a breeze through the Everglades. Proud of his roots, he embodies a relentless spirit, often leaving defenders bewildered with his flashy dribbles. Known for his creative flair on the pitch, he combines skill and tenacity, making him a thrilling player to watch in every match.", "profile_pic": "A portrait of Ryan Martinez, a 25-year-old professional soccer player from the USA. He stands confidently at 182 cm tall and weighs 75 kg, showcasing an athletic build. His facial features include a determined expression, with sharp cheekbones and a slight smile, reflecting his lively personality. He has dark brown, slightly curly hair, and a well-groomed beard that adds to his charismatic vibe.\n\nRyan is dressed in the Everglade FC team kit, which features vibrant green and blue colors, symbolizing the lush landscapes of the Everglades. The kit has the number 22 prominently displayed on his back, along with the team badge on the left chest. He's positioned slightly to the right, with one foot slightly forward, as if he\u2019s ready to sprint onto the field, showing his agility and readiness to play.\n\nThe background is subtly blurred to emphasize his figure, capturing the excitement of matchday with hints of the stadium and fans. His stance conveys confidence and focus, highlighting his strong form, as he does not display any signs of injury. Bright, natural lighting enhances his features and the colors of his kit, creating an inviting and dynamic image full of energy and anticipation."}