{"number": 2, "name": "Matthew Garcia", "age": 32, "nationality": "USA", "shirt_number": 2, "position": "Left Back", "preferred_foot": "Left", "role": "Starter", "team": "Everglade FC", "height_cm": 178, "weight_kg": 76, "overall_rating": 84, "is_injured": false, "form": 8, "goals": 5, "assists": 12, "yellow_cards": 3, "red_cards": 1, "bio": "Matthew Garcia, a left back with a fierce competitive spirit, thrives in the electric atmosphere of Everglade FC. His dynamic runs down the flank and tactical awareness make him a key player in both defense and attacking plays. Known for his precise crosses and fierce tackles, he embodies the untamed energy of Miami's wetlands.", "profile_pic": "A realistic portrait of Matthew Garcia, a 32-year-old professional soccer player, standing confidently in his team kit for Everglade FC. He is 178 cm tall and weighs 76 kg, showcasing an athletic build. His left foot is slightly forward, hinting at his preferred playing style as a left back. \n\nMatthew has a strong jawline, short dark hair styled with a slight tousle, and a focused expression that captures his fierce competitive spirit. His eyes reflect determination and a passion for the game, characteristic of his vibrant personality. He has a light tan, indicative of his time spent playing under the Miami sun.\n\nHe is wearing the Everglade FC home kit, featuring a bright green jersey with white and dark green accents, complemented by black shorts and socks. His shirt number, 2, is prominently displayed on the back of his jersey. \n\nThe background suggests a lively matchday atmosphere with stadium lights and fans blurred in the distance, amplifying the electric vibe of a game day. Matthew's confident stance conveys his strong form rating, and there are no signs of injury, emphasizing his readiness to perform. The mood is upbeat and focused, capturing the essence of a determined athlete in peak condition."}