{"number": 19, "name": "Ryan Moore", "age": 29, "nationality": "USA", "shirt_number": 19, "position": "Striker", "preferred_foot": "Right", "role": "Bench", "team": "Everglade FC", "height_cm": 183, "weight_kg": 78, "overall_rating": 85, "is_injured": false, "form": 7, "goals": 22, "assists": 10, "yellow_cards": 3, "red_cards": 1, "bio": "Ryan Moore, a dynamic striker from the wetlands of Miami, captivates fans with his electrifying speed and exquisite footwork. Known for his ability to weave through defenders like a heron gliding over water, he's a game-changer on the pitch. With an unwavering determination and a fierce pride in his roots, he consistently brings a touch of flair to Everglade FC's vibrant style of play.", "profile_pic": "A realistic portrait of Ryan Moore, a 29-year-old professional soccer player with an athletic build, standing at 183 cm and weighing 78 kg. He has an intense expression, showcasing his determination and confidence. His facial features include a strong jawline, sharp cheekbones, and tousled dark hair, reflecting his vibrant personality. He wears the Everglade FC team kit, primarily in shades of green and blue, with the number 19 prominently displayed on the back. The kit is modern and slick, with sponsor logos tastefully integrated. \n\nHe is posed slightly forward, with one foot positioned confidently in front of the other, as if ready for action, capturing the essence of a striker. The background is a blurred stadium filled with cheering fans, evoking the energy of a matchday. The lighting is bright, highlighting his athletic physique and the sheen of his kit. There are no signs of injury; instead, he radiates a mood of enthusiasm and readiness, embodying his excellent form rating of 7. His posture conveys agility and poise, perfectly representing a dynamic player prepared to make an impact on the pitch."}