{"number": 7, "name": "Ryan Williams", "age": 25, "nationality": "USA", "shirt_number": 7, "position": "Central Mid", "preferred_foot": "Right", "role": "Starter", "team": "Everglade FC", "height_cm": 178, "weight_kg": 75, "overall_rating": 85, "is_injured": false, "form": 8, "goals": 12, "assists": 10, "yellow_cards": 3, "red_cards": 1, "bio": "Ryan Williams, a dynamic central midfielder from the wetlands of Miami, embodies Everglade FC's electric style. Known for his dazzling footwork and fearless tackles, he masterfully orchestrates play while bringing a fiery passion to the pitch that inspires his teammates. His roots in the vibrant ecosystem shape his unpredictable game, making him a fan favorite and an essential starter for the team.", "profile_pic": "A realistic portrait of Ryan Williams, a 25-year-old professional soccer player for Everglade FC. He stands confidently at 178 cm and weighs 75 kg, showcasing a well-built athletic physique. His facial features include a slightly tanned complexion, sharp jawline, and intense green eyes that reflect determination and passion. He has short, tousled dark hair and a slight stubble that gives him a youthful yet rugged charm. \n\nRyan wears the Everglade FC team kit, which consists of a vibrant green jersey adorned with the team's logo on the left chest and his shirt number 7 prominently displayed on the back. His shorts are a complementary dark shade and his socks match the team's color scheme, completing the professional look. \n\nIn the portrait, he stands in a dynamic pose, one arm slightly bent with a soccer ball resting under his right foot, demonstrating confidence and a readiness to play. The background hints at a stadium with blurred cheering crowds, capturing the electric atmosphere of matchday. Ryan's expression is focused and passionate, reflecting his current excellent form, indicating no injuries and a high overall rating of 85, embodying his role as a starter and leader on the field."}