{"number": 6, "name": "Austin Jackson", "age": 23, "nationality": "USA", "shirt_number": 6, "position": "Defensive Mid", "preferred_foot": "Right", "role": "Starter", "team": "Everglade FC", "height_cm": 178, "weight_kg": 70, "overall_rating": 82, "is_injured": false, "form": 7, "goals": 5, "assists": 8, "yellow_cards": 3, "red_cards": 1, "bio": "Austin Jackson, a dynamic midfielder from the heart of Florida, embodies the spirited essence of Everglade FC. His lightning-fast footwork and tenacious tackling make him a formidable presence on the pitch. With roots deeply embedded in the wetlands, Austin plays with a blend of grit and flair, often turning defensive plays into thrilling counter-attacks that leave fans cheering and opponents bewildered.", "profile_pic": "A press photo of Austin Jackson, a 23-year-old American soccer player. He stands confidently at 178 cm tall and weighs 70 kg, showcasing an athletic build typical of a professional defensive midfielder. His sharp facial features include a strong jawline, high cheekbones, and a focused expression that reflects his spirited personality. Austin's dark brown hair is cropped short, and his green eyes exude determination. \n\nHe dons the vibrant team kit of Everglade FC, which features a mix of emerald green and navy blue with accents reminiscent of the Florida wetlands. The number 6 is prominently displayed on his shirt, alongside the team logo on the chest. \n\nAustin is posed in a slight athletic stance, one foot forward, ready for action, with a soccer ball at his feet. The background showcases a stadium filled with fans, adding vibrancy and energy to the scene. The mood is upbeat, reflecting his solid form rating of 7, as he smiles subtly, radiating confidence and readiness, perfectly embodying the essence of a starter who\u2019s on top of his game. There are no signs of injury, emphasizing his strength and capability on the field."}