{"number": 14, "name": "Nicholas Gonzalez", "age": 19, "nationality": "USA", "shirt_number": 14, "position": "Full Back", "preferred_foot": "Left", "role": "Bench", "team": "Everglade FC", "height_cm": 178, "weight_kg": 75, "overall_rating": 85, "is_injured": false, "form": 7, "goals": 3, "assists": 5, "yellow_cards": 2, "red_cards": 0, "bio": "Nicholas Gonzalez, a dynamic Full Back from the wetlands of Miami, embodies the wild spirit of Everglade FC. With his left foot, he possesses a fierce ability to whip in dangerous crosses and initiate breathtaking counter-attacks, all while maintaining a fearless defensive stance. At just 19, his passion on the field mirrors the vibrant energy of his roots, earning him a growing fan base and the respect of his teammates.", "profile_pic": "A realistic portrait of Nicholas Gonzalez, a 19-year-old professional soccer player. He stands at 178 cm tall with a weight of 75 kg, showcasing a lean and athletic build typical of a full back. His skin has a warm, sun-kissed tone, reflecting his Miami roots. \n\nNicholas has expressive dark brown eyes, complemented by thick eyebrows that convey determination. His hair is short and slightly tousled, with a natural wave to it, giving him a youthful and energetic vibe. His face features a confident smile, radiating enthusiasm and passion, with a few freckles across his cheeks hinting at time spent outdoors.\n\nHe is wearing the Everglade FC team kit, which consists of a vibrant green jersey with white and orange trim, displaying his shirt number, 14, prominently on the back. The shorts are matching green with subtle branding, and he sports knee-length socks that follow the same color scheme. His left foot is slightly forward, as if he's ready to sprint down the pitch, portraying both agility and readiness as a bench player in excellent form.\n\nThe background features a blurred soccer field with fans cheering in the stands, creating an electric atmosphere typical of a matchday portrait. The lighting is bright, illuminating his figure and accentuating the details of the kit, while shadows provide depth to the scene, emphasizing his athletic physique. Nicholas stands proudly, embodying the spirit of the game, with an air of youthful confidence and ambition.\n"}