{"number": 13, "name": "Michael Martin", "age": 22, "nationality": "USA", "shirt_number": 13, "position": "Center Back", "preferred_foot": "Left", "role": "Bench", "team": "Everglade FC", "height_cm": 185, "weight_kg": 78, "overall_rating": 75, "is_injured": false, "form": 7, "goals": 2, "assists": 1, "yellow_cards": 4, "red_cards": 0, "bio": "Michael Martin, a determined Center Back at 22, commands the field with his tactical acumen and a left-footed booming clearance. Hailing from the wetlands of Miami, his play style embodies both grit and grace, making him a formidable presence in the backline. Known for his fierce tackles and leadership, he carries the pride of Everglade FC, reflecting the wild and spirited essence of South Florida's ecosystem.", "profile_pic": "A press photo of Michael Martin, a 22-year-old center back for Everglade FC. He stands tall at 185 cm, with a strong build, weighing 78 kg. His left foot is positioned forward, showcasing his preferred kicking stance. \n\nMichael has a slightly chiseled jawline, high cheekbones, and warm brown eyes that convey determination and focus. His dark hair is styled neatly, reflecting a professional demeanor, and he sports a subtle five o'clock shadow. His expression is one of confidence and intensity, ready to command the field.\n\nHe wears the Everglade FC team kit: a vibrant green jersey with white accents, featuring his shirt number 13 prominently on the back. The shorts match the jersey, and he has black and green cleats that complement his outfit. The kit has the team logo on the chest, symbolizing his pride and connection to the club.\n\nThe background features a blurred soccer stadium filled with fans, enhancing the atmosphere while keeping the focus on him. The lighting is bright, evoking a sunny matchday vibe. Michael stands in a slight athletic pose, arms relaxed at his sides, exuding stability and readiness, reflecting his solid current form and status as an invaluable team member. There are no visible signs of injury, indicating his fitness and readiness for the game ahead."}