{"number": 1, "name": "Noah Martin", "age": 21, "nationality": "Canada", "shirt_number": 1, "position": "Goalkeeper", "preferred_foot": "Left", "role": "Starter", "team": "Fraser Valley United", "height_cm": 186, "weight_kg": 82, "overall_rating": 75, "is_injured": false, "form": 8, "goals": 0, "assists": 0, "yellow_cards": 1, "red_cards": 0, "bio": "Noah Martin is a dynamic goalkeeper known for his cat-like reflexes and commanding presence in the box. Hailing from Abbotsford, he embodies the spirit of Fraser Valley United, displaying a fearless attitude and unwavering dedication. A left-footed kicker, he often surprises opponents with precision goal kicks and adept ball distribution, making him a key asset in transitioning from defense to attack.", "profile_pic": "A realistic portrait of Noah Martin, a 21-year-old Canadian goalkeeper standing confidently in his team kit for Fraser Valley United. He is 186 cm tall, with an athletic build weighing 82 kg. Noah has a youthful yet determined expression, showcasing his cat-like reflexes and commanding presence. His facial features include sharp cheekbones, slightly tousled dark hair, and a focused gaze that reflects his fearless attitude. He is wearing a vibrant blue jersey with the team logo prominently displayed on the chest, and his shirt number 1 is visible on the back. The shorts and socks are coordinated in the team's colors, completing the kit.\n\nThe background is a soft focus of a soccer stadium, enhancing the matchday atmosphere. Noah is posed in a slight forward lean, hands on hips, conveying readiness and confidence. He is wearing goalkeeper gloves and has a slight smirk that captures his unwavering dedication to his role. The overall mood is one of determination and focus, reflecting his current high form, with no signs of injury, emphasizing his status as a starter for the team."}