{"number": 3, "name": "Dylan Tremblay", "age": 30, "nationality": "Canada", "shirt_number": 3, "position": "Center Back", "preferred_foot": "Right", "role": "Starter", "team": "Fraser Valley United", "height_cm": 185, "weight_kg": 80, "overall_rating": 84, "is_injured": false, "form": 8, "goals": 3, "assists": 1, "yellow_cards": 4, "red_cards": 0, "bio": "A resolute center back from Canada, Dylan Tremblay excels in aerial duels and displays remarkable composure under pressure. Known for his tactical awareness and leadership qualities, he embodies the spirit of Fraser Valley United, inspiring his teammates with his relentless work ethic and determination on the pitch.", "profile_pic": "**Image Description:**\n\nA realistic portrait of a professional soccer player, Dylan Tremblay, stands at the forefront. He is 30 years old, with a solid build reflecting his 185 cm height and 80 kg weight. His athletic physique conveys strength and resilience, indicative of a seasoned center back. \n\nDylan has a chiseled jawline, defined cheekbones, and closely cropped dark hair with a slight wave. His intense blue eyes are focused, radiating confidence and determination. A light stubble enhances his rugged appearance, adding to his mature vibe. \n\nHe wears the home kit of Fraser Valley United, a vibrant combination of deep green and white with his shirt number, 3, emblazoned across the back. The shirt fits snugly around his muscular frame, showcasing his broad shoulders and powerful arms, while the matching shorts and soccer socks complete the look. \n\nIn a dynamic pose, he stands tall with his hands on his hips, exuding leadership. The backdrop captures the essence of a matchday atmosphere, with a blurred stadium filled with fans in the distance. The lighting is bright, highlighting his features and the team colors, while his expression reflects a sense of focus and readiness, suggesting he\u2019s in peak form, with no injuries to hinder his performance."}