{"number": 11, "name": "Lucas Harris", "age": 32, "nationality": "Canada", "shirt_number": 11, "position": "Right Wing", "preferred_foot": "Left", "role": "Starter", "team": "Fraser Valley United", "height_cm": 178, "weight_kg": 75, "overall_rating": 88, "is_injured": false, "form": 7, "goals": 12, "assists": 9, "yellow_cards": 3, "red_cards": 1, "bio": "Lucas Harris, a dynamic right winger from Canada, captivates fans with his electrifying speed and pinpoint crossing ability. With a fierce competitive spirit, he embodies the heart of Fraser Valley United, navigating the pitch with a signature left-footed finesse. His journey from the vineyards of Abbotsford to the professional arena showcases his relentless dedication and sharp tactical awareness, making him a standout player in the league.", "profile_pic": "A press photo portrait of Lucas Harris, a 32-year-old Canadian soccer player. He stands confidently, wearing the Fraser Valley United home kit, which features a bold red and blue design with subtle graphics. The number 11 is prominently displayed on his jersey. Lucas has a fit, athletic build, standing at 178 cm tall and weighing 75 kg. His facial features include a focused expression, short dark hair with a slight wave, and a well-groomed beard, embodying both intensity and charisma. His left foot is slightly forward, hinting at his preferred playing style, while he is captured in a lively pose, showcasing his agility and readiness for the game. The background of the image is a blurred stadium setting, adding a sense of action and anticipation. The lighting emphasizes his strong jawline and determined eyes, reflecting his competitive spirit and dedication to the sport. The mood is vibrant, showcasing confidence and excitement, indicating his excellent form with a rating of 88 and current standing as an important starter for his team, free from injuries."}