{"number": 19, "name": "Elijah Gagnon", "age": 23, "nationality": "Canada", "shirt_number": 19, "position": "Striker", "preferred_foot": "Right", "role": "Bench", "team": "Fraser Valley United", "height_cm": 183, "weight_kg": 78, "overall_rating": 76, "is_injured": false, "form": 7, "goals": 12, "assists": 5, "yellow_cards": 3, "red_cards": 0, "bio": "Elijah Gagnon, a 23-year-old striker from Canada, possesses an explosive speed and keen eye for goal. His ability to find space and create opportunities for himself and teammates makes him a standout player. Hailing from the scenic Fraser Valley, he brings a combination of technical skill and rural determination to the pitch, often leaving defenders trailing in his wake with his signature swift dribbles and accurate finishing.", "profile_pic": "A realistic portrait of 23-year-old Elijah Gagnon, a professional soccer player from Canada. He stands confidently, showcasing his athletic build with a height of 183 cm and weighing 78 kg. His facial features are sharp and youthful, with short black hair slightly tousled. He has bright, determined eyes that convey focus and ambition, complemented by a confident smile.\n\nElijah is dressed in the team kit of Fraser Valley United, featuring a vibrant blue and white jersey emblazoned with his number 19. The jersey fits snugly, highlighting his well-defined physique, and he sports matching shorts and socks. On his feet are sleek soccer cleats, ready for action.\n\nHe is posed in a dynamic stance, slightly leaning forward as if preparing to sprint, suggesting his explosive speed. The background is a blurred soccer pitch under bright stadium lights, adding to the matchday atmosphere. His expression radiates enthusiasm and readiness, embodying his current form rating of 7, having scored 12 goals this season. There are no signs of injury, and the mood is energetic and hopeful, capturing the essence of a young athlete poised to make an impact on the field."}