{"number": 10, "name": "Thomas Walker", "age": 30, "nationality": "Canada", "shirt_number": 10, "position": "Striker", "preferred_foot": "Left", "role": "Starter", "team": "Fraser Valley United", "height_cm": 182, "weight_kg": 78, "overall_rating": 85, "is_injured": false, "form": 8, "goals": 22, "assists": 10, "yellow_cards": 3, "red_cards": 0, "bio": "Thomas Walker, a dynamic striker from Canada, combines speed and precision with a keen eye for goal. Known for his powerful left-footed shots, he is a constant threat in the box. His leadership on the pitch is matched only by his unyielding determination, making him a fan favorite in Abbotsford.", "profile_pic": "A portrait of Thomas Walker, a 30-year-old Canadian professional soccer player. He stands confidently, measuring 182 cm with a solid build weighing 78 kg. His chiseled features reflect intensity and determination, with sharp blue eyes and short, dark hair slightly tousled. His expression exudes a focused charisma, portraying him as a natural leader.\n\nHe is dressed in the Fraser Valley United team kit, which consists of a vibrant red jersey emblazoned with his shirt number, 10, on the front and back. The kit includes white shorts and red socks accented with a subtle white stripe. The club's emblem is visible on the left chest of the shirt.\n\nThomas is posed in front of a blurred stadium backdrop, suggesting a matchday atmosphere. His left foot is slightly forward, portraying a sense of movement and energy. There\u2019s a hint of a smile, showcasing his approachable personality, paired with an eagerness that reflects his excellent form, having scored 22 goals and provided 10 assists this season. The absence of any visible injuries further contributes to his display of athletic prowess and readiness, capturing the essence of a passionate striker in peak condition. The overall lighting enhances the vibrancy of the kit and highlights his athletic physique, evoking a sense of anticipation for the game ahead."}