{"number": 5, "name": "Aiden Smith", "age": 27, "nationality": "Canada", "shirt_number": 5, "position": "Right Back", "preferred_foot": "Left", "role": "Starter", "team": "Fraser Valley United", "height_cm": 182, "weight_kg": 78, "overall_rating": 85, "is_injured": false, "form": 7, "goals": 3, "assists": 5, "yellow_cards": 2, "red_cards": 0, "bio": "Aiden Smith is a dynamic right back known for his fierce tackling and relentless work ethic on the pitch. Hailing from the picturesque landscapes of British Columbia, he embodies both rural resilience and urban sophistication. His ability to read the game allows him to initiate counter-attacks quickly, making him a valuable asset to Fraser Valley United. Aiden's left foot delivers precise crosses, often setting up scoring opportunities for his teammates, solidifying his role as a cornerstone of the team's defense.", "profile_pic": "Aiden Smith, a 27-year-old Canadian male, stands confidently in a dynamic pose, his athletic build accentuated by his 182 cm height and 78 kg weight. His face reflects determination, with strong cheekbones and a chiseled jawline, framed by short, well-groomed dark hair. He has piercing green eyes that convey a fierce yet approachable personality. \n\nWearing the Fraser Valley United team kit, the jersey is predominantly deep blue with white accents, featuring his number 5 on the back and front. His shorts are also deep blue, and he sports matching blue socks that feature a subtle design. The team's logo is displayed prominently on the left chest area, while his left foot is slightly forward, emphasizing his preferred foot.\n\nAiden's stance suggests readiness, hinting at his active role as a starter right back. His expression is one of focused confidence, radiating energy as he stands on a well-maintained soccer pitch, with the distant outline of mountains visible in the background, representing his Canadian heritage. The lighting is bright, capturing a matchday atmosphere, as he is in peak form, reflecting an overall rating of 85. His body language suggests no signs of injury, exuding a sense of pride and readiness for competition."}