{"number": 16, "name": "Logan Clark", "age": 26, "nationality": "Canada", "shirt_number": 16, "position": "Central Mid", "preferred_foot": "Right", "role": "Bench", "team": "Fraser Valley United", "height_cm": 178, "weight_kg": 73, "overall_rating": 85, "is_injured": false, "form": 7, "goals": 12, "assists": 8, "yellow_cards": 3, "red_cards": 1, "bio": "Logan Clark, a dynamic central midfielder, thrives on the pitch with his vision and precise passing. Hailing from the serene landscapes of rural British Columbia, he embodies the spirit of Fraser Valley United. Known for his relentless work ethic and ability to dictate the tempo of the game, Logan is a fan favorite, often dazzling spectators with his cheeky nutmegs and long-range strikes.", "profile_pic": "A portrait of Logan Clark, a fictional Canadian professional soccer player, standing confidently in the Fraser Valley United team kit, which features a deep green jersey with white accents and the club logo on the left chest. He wears the number 16 prominently displayed on both the front and back of his shirt. Logan is 26 years old, with a lean yet muscular build, standing at 178 cm tall and weighing 73 kg. He has short, tousled dark hair and sharp features that convey determination and focus. His right foot is slightly forward, symbolizing his preferred kicking foot, while his left hand rests on his hip, exuding a relaxed yet ready-to-play vibe. \n\nHis expression is a mix of concentration and enthusiasm, reflecting his role as a bench player who is eager to make an impact. The background is a blurred image of a soccer stadium filled with cheering fans, capturing the excitement of match day. The lighting is bright and highlights the sheen on his kit, with a slight lens flare to add energy to the scene. Despite being in peak form, there are no indications of injury, showcasing his readiness to contribute on the field. In the portrait, Logan holds a soccer ball in his left hand, ready for action, with his right foot planted firmly on the ground, embodying the spirit of a dedicated midfielder."}