{"number": 9, "name": "Dylan Walker", "age": 30, "nationality": "Canada", "shirt_number": 9, "position": "Left Wing", "preferred_foot": "Right", "role": "Starter", "team": "Fraser Valley United", "height_cm": 178, "weight_kg": 75, "overall_rating": 85, "is_injured": false, "form": 8, "goals": 15, "assists": 10, "yellow_cards": 3, "red_cards": 1, "bio": "Dylan Walker is a dynamic left winger known for his lightning speed and precise dribbling. Hailing from the vineyards of Abbotsford, he embodies the spirit of Fraser Valley United, bringing a blend of rural charm and relentless determination to the pitch. His ability to create scoring opportunities and deliver pinpoint crosses makes him a fan favorite, while his competitive attitude inspires his teammates to elevate their game.", "profile_pic": "A realistic portrait of Dylan Walker, a 30-year-old Canadian soccer player. He is 178 cm tall, athletic build weighing 75 kg. His expression conveys confidence and determination, with sharp green eyes, slightly tousled dark hair, and a hint of stubble. He wears the Fraser Valley United team kit, which features a bold blend of green and white colors, with his number 9 prominently displayed on the back. The kit is snug fitting, accentuating his muscular physique. \n\nWalker poses dynamically, slightly leaning forward as if he's ready to sprint down the pitch, embodying his role as a left winger. The background is blurred to focus on him, but hints at a vibrant stadium atmosphere, perhaps during matchday with fans in the stands. Despite being in peak form with an overall rating of 85, his demeanor reflects a fierce competitive spirit without any signs of injury. The lighting is bright and focused on him, emphasizing the intensity of the moment."}