{"number": 15, "name": "Aiden Brown", "age": 17, "nationality": "Canada", "shirt_number": 15, "position": "Defensive Mid", "preferred_foot": "Left", "role": "Bench", "team": "Fraser Valley United", "height_cm": 178, "weight_kg": 72, "overall_rating": 85, "is_injured": false, "form": 8, "goals": 5, "assists": 10, "yellow_cards": 3, "red_cards": 1, "bio": "Aiden Brown, hailing from the scenic landscapes of Abbotsford, is a dynamic defensive mid known for his tenacity and vision on the field. With an elegant left foot, he often orchestrates play from deep positions, making him a linchpin in Fraser Valley United's midfield. His fearless attitude and commitment to the team have made him a crowd favorite, often seen breaking up opposition attacks and launching quick counterplays.", "profile_pic": "Aiden Brown stands confidently in a press photo setting, showcasing his athletic build at 178 cm tall and weighing 72 kg. He appears 17 years old, with a youthful yet determined expression, his sharp facial features reflecting a Canadian heritage. His dark hair is slightly tousled, framing his face, and he sports a light scruff.\n\nWearing the Fraser Valley United team kit, which features a bold combination of navy blue and white, his shirt, number 15, fits snugly, emphasizing his athletic physique. The kit includes a stylish design with the team crest emblazoned on the left chest, and his defensive mid role is highlighted by the sleek shorts and matching socks.\n\nAiden is posed in a dynamic yet relaxed stance with his left foot slightly forward, exuding confidence and readiness. The background features a subtle blur of a soccer pitch, hinting at a matchday atmosphere. He smiles, projecting a sense of camaraderie and enthusiasm, his eyes focused on something off-camera, indicating his commitment to the game. With an overall rating of 85 and strong form at 8, there are no signs of injury on his relaxed posture, further emphasizing his vigorous spirit and determination on the field."}