{"number": 19, "name": "Sebasti\u00e1n Mora", "age": 29, "nationality": "Costa Rica", "shirt_number": 19, "position": "Striker", "preferred_foot": "Right", "role": "Bench", "team": "Tierra Alta FC", "height_cm": 182, "weight_kg": 78, "overall_rating": 85, "is_injured": false, "form": 7, "goals": 12, "assists": 5, "yellow_cards": 3, "red_cards": 1, "bio": "Sebasti\u00e1n Mora is known for his lightning-fast pace and clinical finishing. With roots in the lush landscapes of Costa Rica, he plays with a fiery passion that ignites the crowd. A versatile striker, he thrives in tight spaces, often beating defenders with his agile footwork and keen tactical awareness.", "profile_pic": "A professional portrait of Sebasti\u00e1n Mora, a 29-year-old Costa Rican soccer player. He stands confidently, showcasing his athletic build at 182 cm tall and weighing 78 kg. His right foot is slightly forward, suggesting readiness and agility. He wears the Tierra Alta FC home kit, featuring bold colors of deep green and white, with the number 19 emblazoned on the back. \n\nHis facial features include a strong jawline, tanned skin, and expressive dark brown eyes that reflect determination and passion. His dark hair is neatly styled, emphasizing his focus and dedication. There are subtle hints of a competitive spirit in his posture, with a slight smile revealing his confident personality, embodying the vivacity of his Costa Rican roots.\n\nThe background is a blurred soccer stadium, hinting at an electrifying matchday atmosphere, capturing the energy of the fans. The lighting is bright, casting a warm glow across him, perfectly highlighting his robust physique and the details of the kit. The overall mood is optimistic and spirited, reflecting his solid form rating of 7, with no injuries present to dampen his enthusiasm."}