{"number": 12, "name": "Alonso Camacho", "age": 26, "nationality": "Costa Rica", "shirt_number": 12, "position": "Goalkeeper", "preferred_foot": "Left", "role": "Bench", "team": "Tierra Alta FC", "height_cm": 185, "weight_kg": 78, "overall_rating": 82, "is_injured": false, "form": 7, "goals": 0, "assists": 0, "yellow_cards": 1, "red_cards": 0, "bio": "Alonso Camacho, standing tall at 185 cm, commands the goal with a blend of agility and strong presence. His left foot is legendary for precision kicking, often launching counter-attacks. Hailing from the lush landscapes of Costa Rica, he embodies resilience and dedication on the pitch, making crucial saves that ignite the crowd's spirit.", "profile_pic": "A realistic portrait of a 26-year-old male soccer player named Alonso Camacho, standing at 185 cm tall and weighing 78 kg. He has a strong, athletic build, a light tan complexion, and is slightly muscular. His facial features include short, dark hair, sharp jawline, and a focused expression reflecting determination and confidence. He showcases a few faint freckles across his cheeks, hinting at his Costa Rican heritage.\n\nAlonso is dressed in the Tierra Alta FC team kit, featuring a vibrant green and black color scheme with the team logo prominently displayed on the chest. He wears the number 12 on his jersey, and his shirt is slightly fitted, accentuating his physique. His goalkeeper gloves are black with green accents, and he stands with one hand raised slightly as if ready to make a save.\n\nThe mood of the portrait is energetic and focused, capturing a moment of calm before the action of a match. He stands against a blurred stadium background, hinting at a lively atmosphere. His posture is confident, with a slight forward lean that conveys readiness and determination, free from any signs of injury. The overall vibe encapsulates his role as a key player on the team, poised and prepared for the game ahead."}