{"number": 10, "name": "Felipe Z\u00fa\u00f1iga", "age": 25, "nationality": "Costa Rica", "shirt_number": 10, "position": "Striker", "preferred_foot": "Right", "role": "Starter", "team": "Tierra Alta FC", "height_cm": 178, "weight_kg": 75, "overall_rating": 88, "is_injured": false, "form": 8, "goals": 15, "assists": 7, "yellow_cards": 3, "red_cards": 0, "bio": "Felipe Z\u00fa\u00f1iga, a dynamic striker from Costa Rica, dazzles with his agility and clinical finishing. Known for his fierce determination and tactical acumen, he often finds the back of the net from impossible angles. With a passion rooted in the lush landscapes of San Jos\u00e9, he plays each match with a zealous spirit that resonates with Tierra Alta FC's commitment to excellence.", "profile_pic": "A dynamic portrait of a 25-year-old Costa Rican professional soccer player, Felipe Z\u00fa\u00f1iga. He stands confidently at 178 cm tall and weighs 75 kg, showcasing a lean and athletic build. His facial features include sharp cheekbones, a strong jawline, and a determined expression that reflects his fierce spirit. He has dark, slightly wavy hair styled neatly, with intense brown eyes that convey a sense of focus and passion. \n\nHe wears the Tierra Alta FC team kit: a vibrant green jersey with white accents, emblazoned with the number 10 prominently on the front and back. The jersey fits snugly, emphasizing his athletic form, while black shorts and matching green socks complete the look. His right foot is slightly forward, balanced and ready, suggesting a poised readiness to strike.\n\nThe background features a blurred soccer field with cheering fans, evoking matchday excitement. The mood of the portrait is optimistic and energizing, reflecting his excellent current form rating of 8, without signs of injury. Sunlight catches the gloss of his kit, highlighting the dedication and vitality he brings to the game."}