{"number": 23, "name": "Gabriel Chac\u00f3n", "age": 25, "nationality": "Costa Rica", "shirt_number": 23, "position": "Various", "preferred_foot": "Right", "role": "Reserve/Prospect", "team": "Tierra Alta FC", "height_cm": 178, "weight_kg": 75, "overall_rating": 82, "is_injured": false, "form": 7, "goals": 15, "assists": 10, "yellow_cards": 3, "red_cards": 1, "bio": "Gabriel Chac\u00f3n, with his deft footwork and tactical awareness, mesmerizes fans with a style that seamlessly blends creativity and precision. Emerging from the lush landscapes of Costa Rica, he embodies the spirit of Tierra Alta FC, often making crucial plays that ignite the team\u2019s momentum. His resilience and determination make him a rising star, as he strives to etch his name in the hearts of supporters.", "profile_pic": "The portrait features Gabriel Chac\u00f3n, a 25-year-old Costa Rican professional soccer player, standing confidently in the team's colors. He has a well-built athletic physique, standing at 178 cm tall and weighing 75 kg. His dark, expressive eyes reflect determination and passion, framed by slightly tousled dark hair, indicative of a lively personality. \n\nGabriel is wearing the Tierra Alta FC kit, which consists of a vibrant green jersey with white accents and the team's crest prominently displayed on the chest. His shirt number, 23, is visibly printed on the back, completing the ensemble with matching shorts and socks. \n\nIn this image, he's posed in a dynamic stance, slightly leaning forward with his right foot raised, showcasing his preferred foot. His expression exudes confidence and readiness, hinting at his strong form with a rating of 82. The background is a blurred stadium scene, capturing the excitement of match day, and the atmosphere is electric, reflecting the anticipation of the supporters. Gabriel\u2019s posture and focus suggest a player who is in form and eager to make an impact on the pitch, embodying resilience and the spirit of the game."}