{"number": 4, "name": "Marco Salazar", "age": 21, "nationality": "Costa Rica", "shirt_number": 4, "position": "Center Back", "preferred_foot": "Right", "role": "Starter", "team": "Tierra Alta FC", "height_cm": 182, "weight_kg": 75, "overall_rating": 85, "is_injured": false, "form": 8, "goals": 2, "assists": 1, "yellow_cards": 3, "red_cards": 0, "bio": "Marco Salazar, a towering presence in defense, excels at intercepting passes and launching counter-attacks with pinpoint accuracy. Born in the heart of Costa Rica, his fierce competitiveness and tactical intelligence make him a cornerstone for Tierra Alta FC, embodying the team's sustainable spirit and ambition.", "profile_pic": "A realistic portrait of Marco Salazar, a 21-year-old Costa Rican professional soccer player for Tierra Alta FC, wearing a tightly-fitted team kit in vibrant colors. He stands confidently, displaying his solid 182 cm height and athletic build of 75 kg. His striking facial features include high cheekbones, a strong jawline, and short, slightly tousled dark hair. His expression is focused yet approachable, hinting at his fierce competitiveness and tactical intelligence.\n\nThe team kit features the number 4 prominently on his chest, with a crest on the left side representing Tierra Alta FC. The shorts match the jersey, showcasing the team's dynamic colors. In the background, a blurred stadium environment emphasizes the matchday vibe, with fans in the stands and stadium lights brightening the scene. Marco stands with his arms crossed, exuding confidence, showcasing a mood of determination and readiness for the match, reflecting his top form rating of 8 and absence of injury."}