{"number": 8, "name": "Pablo Ure\u00f1a", "age": 23, "nationality": "Costa Rica", "shirt_number": 8, "position": "Central Mid", "preferred_foot": "Left", "role": "Starter", "team": "Tierra Alta FC", "height_cm": 178, "weight_kg": 70, "overall_rating": 86, "is_injured": false, "form": 7, "goals": 10, "assists": 15, "yellow_cards": 3, "red_cards": 1, "bio": "Pablo Ure\u00f1a is a dynamic central midfielder known for his visionary passing and tenacious tackling. Hailing from the lush landscapes of Costa Rica, he embodies a vibrant playing style marked by his left-footed precision and a knack for game-changing assists. He's a passionate player who thrives under pressure, often seen rallying teammates with his relentless spirit.", "profile_pic": "A dynamic portrait of Pablo Ure\u00f1a, a 23-year-old Costa Rican professional soccer player. He stands confidently against a vibrant green soccer pitch backdrop, showcasing his athletic build at 178 cm tall and weighing 70 kg. His expressive face features a strong jawline, deep-set dark eyes, and a friendly smile, reflecting his passionate personality. His left foot is slightly raised, as if ready for a play, embodying his role as a central midfielder. Dressed in the Tierra Alta FC team kit, his number 8 jersey is primarily in sky blue with white trim, complemented with navy shorts and matching socks. The kit has a subtle texture that hints at the competition's intensity. The mood is energetic yet focused, showcasing his solid form with an overall rating of 86. Despite wearing the scars of competition with three yellow cards and one red card indicated by a slight bruise on his forearm, he exudes resilience and determination, suggesting he is currently in strong form without any injury concerns. The natural lighting accentuates his features and the vibrant colors of the team kit, creating an engaging and motivational press photo."}