{"number": 11, "name": "Gabriel Fonseca", "age": 30, "nationality": "Costa Rica", "shirt_number": 11, "position": "Right Wing", "preferred_foot": "Right", "role": "Starter", "team": "Tierra Alta FC", "height_cm": 178, "weight_kg": 72, "overall_rating": 85, "is_injured": false, "form": 8, "goals": 22, "assists": 15, "yellow_cards": 3, "red_cards": 1, "bio": "Gabriel Fonseca, a vibrant Right Wing, dazzles crowds with his blistering pace and deft touches. Born in the lush landscapes of Costa Rica, he brings not only skill but a passionate flair to each match, embodying the spirit of Tierra Alta FC. A formidable playmaker, he is known for his deadly crosses and an unyielding determination to uplift his team, always pushing boundaries on the pitch.", "profile_pic": "A portrait of Gabriel Fonseca, a 30-year-old Costa Rican professional soccer player, standing confidently against a blurred stadium backdrop that hints at the excitement of match day. He is in his Tierra Alta FC home kit, featuring a vibrant green and white jersey with his number 11 on the back, complemented by matching shorts and socks. The kit reflects the team's colors, adorned with a subtle logo on the chest.\n\nGabriel is 178 cm tall, with a lean but athletic build weighing 72 kg. His facial features are distinctly Costa Rican, with warm brown skin, expressive dark eyes, and a friendly, charismatic smile that conveys his vibrant personality. His hair is styled in short, slightly tousled waves, showcasing a hint of his playful spirit. \n\nHe stands in a dynamic pose, slightly turned to the right, with his right foot forward as if he's about to sprint down the wing, embodying his role as a Right Wing. His posture radiates confidence and readiness, enhanced by the relaxed yet determined expression on his face. Sunlight catches the sheen on his jersey, highlighting his focus and passion for the game. \n\nThere are no signs of injury; instead, he exudes a sense of form and excellence, reflective of his recent performance with an overall rating of 85. Behind him, the stadium is filled with fans, creating an electrifying atmosphere that complements the image of a formidable playmaker eager to uplift his team with every match."}