{"number": 5, "name": "Ricardo Cordero", "age": 19, "nationality": "Costa Rica", "shirt_number": 5, "position": "Right Back", "preferred_foot": "Left", "role": "Starter", "team": "Tierra Alta FC", "height_cm": 178, "weight_kg": 75, "overall_rating": 82, "is_injured": false, "form": 7, "goals": 2, "assists": 5, "yellow_cards": 3, "red_cards": 1, "bio": "Ricardo Cordero, the dynamic Right Back for Tierra Alta FC, showcases explosive pace and relentless energy on the field. Hailing from the lush terrains of Costa Rica, he combines an aggressive defensive style with precise crossing ability, making him a dual threat. Known for his determination and tactical awareness, Cordero's tenacity and vibrant presence inspire his teammates, helping them thrive in both domestic and international competitions.", "profile_pic": "A realistic portrait of a young male soccer player, Ricardo Cordero, age 19, standing confidently in a professional studio setting. He has a height of 178 cm and a weight of 75 kg, showcasing a fit and athletic build. His skin tone is a warm, sun-kissed tan, indicative of his Costa Rican nationality. He has dark, short hair styled in a modern cut and expressive brown eyes that exude determination.\n\nRicardo wears the Tierra Alta FC team kit, prominently featuring the colors green and white, with number 5 on his jersey. The kit is designed with a sleek, contemporary look, emphasizing his role as a right-back. His left foot is slightly forward, showcasing a dynamic pose that communicates energy and readiness for action.\n\nThe background is a subtle gradient, enhancing the focus on him and giving a professional, polished appearance. Ricardo's expression is one of fierce concentration and confidence, reflecting his current form rating of 7, as well as his inspiration to his teammates. He stands tall, embodying the spirit of a young athlete poised for success, free from injury."}