{"number": 20, "name": "Sebasti\u00e1n Alvarado", "age": 27, "nationality": "Costa Rica", "shirt_number": 20, "position": "Left Wing", "preferred_foot": "Right", "role": "Bench", "team": "Tierra Alta FC", "height_cm": 178, "weight_kg": 72, "overall_rating": 85, "is_injured": false, "form": 7, "goals": 12, "assists": 8, "yellow_cards": 3, "red_cards": 0, "bio": "Sebasti\u00e1n Alvarado is a dynamic left winger known for his explosive speed and precise crossing ability. Hailing from Costa Rica, he embodies a spirited determination and flair on the pitch. With a keen eye for goal and a tenacious work ethic, he's a vital asset to Tierra Alta FC, thrilling fans with his creativity and relentless pursuit of victory.", "profile_pic": "A realistic portrait of Sebasti\u00e1n Alvarado, a 27-year-old Costa Rican professional soccer player. He stands confidently at 178 cm tall and weighing 72 kg, showcasing an athletic build typical of a left winger. His facial features include dark hair styled in a modern cut, expressive brown eyes that exude determination, and a warm smile that reflects his spirited personality. Dressed in his Tierra Alta FC home kit, which consists of a vibrant green jersey adorned with the team's logo, white shorts, and green and white socks, he also sports the number 20 on his back. His right foot is slightly forward, suggesting readiness, as he strikes a dynamic pose typical of a press photo, embodying his explosive speed and creativity on the field. The background is a blurred stadium with cheering fans, capturing the electrifying atmosphere of a matchday. His focused expression highlights his current good form, reflected in a rating of 85, while the absence of any injury gives him an air of vitality and vibrancy."}