{"number": 17, "name": "Carlos Solano", "age": 29, "nationality": "Costa Rica", "shirt_number": 17, "position": "Attacking Mid", "preferred_foot": "Right", "role": "Bench", "team": "Tierra Alta FC", "height_cm": 175, "weight_kg": 70, "overall_rating": 84, "is_injured": false, "form": 7, "goals": 12, "assists": 18, "yellow_cards": 5, "red_cards": 1, "bio": "Carlos Solano, a 29-year-old attacking midfielder from Costa Rica, dazzles on the field with his quick dribbling and pinpoint passes. Known for his tactical intelligence and relentless energy, he often orchestrates plays that leave the opposition guessing. A fan favorite at Tierra Alta FC, his passion for sustainability reflects both in his game and outside, making him a symbol of the team's green values.", "profile_pic": "Create a portrait of Carlos Solano, a 29-year-old Costa Rican attacking midfielder for Tierra Alta FC. He stands confidently at 175 cm tall and weighing 70 kg, showcasing a fit and athletic build. His facial features include a warm smile, deep brown eyes, and a slightly tanned complexion, framed by short, wavy black hair. His expression conveys determination and charisma, capturing his vibrant personality.\n\nCarlos is dressed in the Tierra Alta FC team kit, featuring a green and white shirt with the number 17 clearly visible on the back. The shorts are green, and he wears matching green socks with white stripes. The kit also includes the club logo on the chest, symbolizing his strong connection to the team's values, especially sustainability.\n\nHe is posed in a dynamic stance, perhaps with one foot slightly forward, exuding energy and readiness, reflecting his current good form rating of 7. There's a slight shine of sweat on his brow, indicating his recent involvement in training or a match, while his absence of injuries adds to a sense of vigor and resilience.\n\nThe background is a blurred impression of a soccer field, with hints of goalposts and cheering fans, emphasizing his role as a fan favorite. The lighting is bright and energetic to highlight his vitality and passion for the game, creating an overall atmosphere of excitement and professionalism."}