{"number": 10, "name": "Ram\u00f3n Jim\u00e9nez", "age": 26, "nationality": "Mexico", "shirt_number": 10, "position": "Striker", "preferred_foot": "Left", "role": "Starter", "team": "Yucatan Force", "height_cm": 182, "weight_kg": 78, "overall_rating": 85, "is_injured": false, "form": 8, "goals": 24, "assists": 12, "yellow_cards": 3, "red_cards": 0, "bio": "Ram\u00f3n Jim\u00e9nez, a fierce competitor from the heart of Mexico, thrives on the pitch with his explosive speed and clinical finishing. A left-footed maestro, he dances past defenders with grace, often leaving them bewildered. Known for his relentless work ethic and an infectious passion for the game, he embodies the spirit of Yucat\u00e1n Force, proving time and again that he can turn a match on its head with a single strike.", "profile_pic": "A 26-year-old male soccer player stands confidently in a professional team kit representing the Yucatan Force. He is 182 cm tall and weighs 78 kg, showcasing an athletic build that indicates strength and agility. His uniform features the team's vibrant colors, predominantly electric blue with striking yellow accents, and his shirt proudly displays the number 10 on the back. The fabric glistens slightly under the lights of the stadium, hinting at the intensity of the game.\n\nRam\u00f3n Jim\u00e9nez has a distinctive look that reflects his Mexican heritage. His skin is a warm, medium tone, and he has short, neatly styled black hair with subtle highlights. His facial features are sharp, with high cheekbones and a strong jawline, further emphasizing his intense gaze. His expressive dark brown eyes radiate determination and confidence, revealing his fierce competitive spirit.\n\nIn this dynamic pose, Ram\u00f3n is slightly turned with a foot raised, ready to engage in action, embodying the essence of a striker. His left foot is forward, demonstrating his preferred kicking foot, and he exudes an aura of excitement and energy, still fresh from a recent match where he scored two goals. \n\nThe background features a blurred stadium filled with cheering fans, creating an electric atmosphere while allowing Ram\u00f3n to stand out as the focal point. There are no visible signs of injury, emphasizing his strong form with a rating of 85. The image captures both his physical prowess and the infectious passion he brings to the game, perfectly embodying the spirit of a dedicated athlete."}