{"number": 3, "name": "Luis Navarro", "age": 25, "nationality": "Mexico", "shirt_number": 3, "position": "Center Back", "preferred_foot": "Right", "role": "Starter", "team": "Yucatan Force", "height_cm": 180, "weight_kg": 75, "overall_rating": 85, "is_injured": false, "form": 8, "goals": 2, "assists": 1, "yellow_cards": 3, "red_cards": 0, "bio": "Luis Navarro, a stalwart at the back, orchestrates the defensive line with a commanding presence. Known for his unyielding tackles and precise aerial ability, he embodies the fighting spirit of his roots in M\u00e9rida. With a fierce determination and a knack for stepping up in crucial moments, Navarro has become a fan favorite, earning respect as a leader both on and off the pitch.", "profile_pic": "A realistic portrait of Luis Navarro, a 25-year-old Mexican soccer player. He stands confidently at 180 cm, weighing 75 kg, showcasing a strong athletic build. Navarro has a chiseled jawline, warm brown skin, and is sporting short, neatly styled dark hair. His intense brown eyes convey determination and leadership. He is wearing the Yucatan Force's home team kit, which features a vibrant green shirt with white accents, the team's logo prominently on his left chest, and his shirt number, 3, displayed on the back. The shorts are also green, paired with white socks that have green stripes. \n\nLuis is posed at an angle, slightly turned to the left, giving off an air of readiness and resilience. His strong arms are crossed over his chest, reflecting his role as a center back and starter for the team. The background is a blurred soccer pitch under bright stadium lights, hinting at matchday excitement. His confident demeanor is accentuated by a subtle smile, and he appears in peak form, reflecting his overall rating of 85, without any sign of injury. The mood of the image is one of triumph and anticipation, capturing the essence of a fan favorite and fierce competitor."}