{"number": 18, "name": "Emilio Navarro", "age": 24, "nationality": "Mexico", "shirt_number": 18, "position": "Forward/Winger", "preferred_foot": "Left", "role": "Bench", "team": "Yucatan Force", "height_cm": 177, "weight_kg": 72, "overall_rating": 86, "is_injured": false, "form": 8, "goals": 12, "assists": 7, "yellow_cards": 3, "red_cards": 1, "bio": "Emilio Navarro, a dazzling presence on the field, combines blistering pace with a keen eye for goal. Born and raised in the vibrant streets of M\u00e9rida, he showcases his Mexican heritage with every electrifying run. Known for his trademark left-foot curler, Navarro's tenacity and flair make him a fan favorite at El Templo del Sol, where he consistently thrills supporters with his audacious plays.", "profile_pic": "A press photo of Emilio Navarro, 24 years old, standing confidently in front of the Yucatan Force emblem. He stands at 177 cm with a lean, athletic build, weighing 72 kg. His expression is determined yet approachable, showcasing a charming smile that reflects his vibrant personality. Emilio has short, slightly tousled black hair, warm brown eyes, and a hint of stubble, bringing out his youthful energy. \n\nHe's wearing the Yucatan Force home kit, which consists of a vibrant green jersey with the number 18 emblazoned on the back and front in bold white lettering. The kit features intricate patterns that symbolize his Mexican heritage, complemented by matching shorts and green socks. His left foot is slightly forward, demonstrating his preferred side, with one hand resting on his hip and the other casually running through his hair.\n\nThe background is blurred, suggesting the electrifying atmosphere of a matchday at El Templo del Sol, with fans cheering in the distance. The mood is confident and uplifting, as Emilio stands strong and ready, embodying the essence of a forward/winger at the peak of his form, hinting at his impressive overall rating of 86 while underscoring that he is currently injury-free."}