{"number": 23, "name": "Pablo Vargas", "age": 24, "nationality": "Mexico", "shirt_number": 23, "position": "Various", "preferred_foot": "Right", "role": "Reserve/Prospect", "team": "Yucatan Force", "height_cm": 178, "weight_kg": 70, "overall_rating": 78, "is_injured": false, "form": 7, "goals": 12, "assists": 5, "yellow_cards": 3, "red_cards": 1, "bio": "Pablo Vargas is a dynamic playmaker known for his quick footwork and creative vision on the pitch. Hailing from the vibrant streets of M\u00e9rida, he embodies the spirit of the Yucat\u00e1n Force, dazzling fans with his unpredictable dribbles and fearless attitude. A product of local talent, his signature move, a swift cut inside followed by a powerful shot, has made him a crowd favorite, leaving defenders bewildered and the stands erupting with excitement.", "profile_pic": "A portrait of Pablo Vargas, a 24-year-old Mexican soccer player, standing confidently on a vibrant pitch. He is 178 cm tall, weighing 70 kg, showcasing a dynamic, athletic build. His facial features reflect his Mexican heritage, with warm brown skin, dark, expressive eyes, and shoulder-length black hair tied back, accentuating a focus and determination in his expression.\n\nWearing the Yucatan Force's home team kit, the jersey is a bright green with bold, white accents, featuring his number 23 prominently on the back. He has matching green shorts and socks adorned with the team\u2019s logo, and his right foot is slightly forward, hinting at readiness and agility. \n\nThe background captures a lively stadium filled with cheering fans, hinting at the excitement of a match day. The lighting is bright and warm, casting a pleasant glow on his face, emphasizing his dynamic personality as a playful yet competitive athlete. His stance is relaxed but assertive, embodying his role as a reserve/prospect who is eager to make an impact, with no sign of injury, indicating peak form and vibrant energy."}